{
  "schemaVersion": 1,
  "key": "workbench.example-alchemy-workbench",
  "id": 9200000,
  "sourceDoodadId": 6387,
  "names": {
    "en_us": "Example Alchemy Workbench"
  },
  "modelOverride": null,
  "craftPack": {
    "id": 9300000,
    "name": "custom_example-alchemy-workbench"
  },
  "recipeIds": [
    9100000
  ],
  "rowIds": {
    "functionGroups": {
      "16902": 9850000,
      "16903": 9850001
    },
    "functions": {
      "13830": 9875000,
      "13831": 9875001,
      "13832": 9875002,
      "13833": 9875003
    },
    "phaseFunctions": {
      "22358": 9900000,
      "22359": 9900001
    },
    "craftPackPayloads": {
      "129": 9925000,
      "130": 9925001
    },
    "localization": {
      "name": 9600001
    },
    "craftPackLinks": [
      9800000
    ]
  }
}
